{
  "schemaVersion": "1.0",
  "title": "Historical Rocoto production build task graph",
  "authority": "Historical implementation inventory retained from the earlier kit. Paths, policies and statuses below describe that snapshot. Current subject contracts are indexed in docs/INDEX.md; the kit-to-product plan and GitHub issues govern current work. Reconcile individual tasks with those contracts before reuse.",
  "statusValues": [
    "SPECIFIED",
    "KIT",
    "WIRED",
    "PRODUCTION"
  ],
  "statusDefinitions": {
    "SPECIFIED": "Contracted work with no claim that a production connection exists.",
    "KIT": "A design-kit interaction or presentation has been checked; it is not a tenant-safe runtime implementation.",
    "WIRED": "An implemented runtime boundary has named contract evidence in a controlled environment.",
    "PRODUCTION": "A release-gated runtime boundary has live operational evidence; this status never authorizes a deployment by itself."
  },
  "policies": [
    "Stages express dependency order only. They do not shrink scope, grant production authority, or mark an earlier stage as a separate product.",
    "Every command is server-authorized, tenant-scoped, idempotent where retryable, revision-checked where mutable, and auditable.",
    "A client-side flag, a successful-looking control, or a queued job is never proof of an accepted command, external receipt, or completed provider action.",
    "Interaction patterns are local to their surface. There is no global limit on actions or menus; every action must instead have a named owner, state model, accessible name, and evidence path.",
    "Unknown, pending, unavailable, failed, denied, and empty are distinct states. Copy must name the known fact without inventing business data or provider completion.",
    "The graph covers the full production system. An unmet external dependency is a visible blocked condition with a recovery path, not an omitted task or a fabricated success state. A release profile distinguishes capability that is designed, enabled for a tenant, and proven by independent runtime evidence; a built screen or configured connector is neither an enabled capability nor proof of a completed external action.",
    "The `order-review` launch profile enables literal tenant SKU review, reviewed exact-SKU art, explicit accepted uncoded sale-item records, inbound source review, explicit line resolution, reasoned reply attention, unvalued albarans, native provider handoff and print/file output. An uncoded sale item is only admitted from an explicitly accepted off-SKU Albarán line; it retains literal wording/unit and cannot silently become SKU/ERP/stock/tariff master data. Direct related-item links may join coded or uncoded records, are sparse/reciprocal/non-transitive, and never follow category/repetition. Pricing/tariffs, stock/inventory/lots/supplier intake, customer outbound and ERP automation remain designed production leaves, visibly disabled until their own evidence gates pass. Navbar Export, Sales-day and Albarán output doors share one gallery-template → configured-saved-copy → immutable-output-attempt contract. A scheduled subcontractor order-list email, if enabled, is a first-class Export destination with its own recipient rule, attachment/template, schedule, history and truthful provider-receipt contract; it is never customer messaging. WhatsApp starts forward-only at accepted connection time and never exposes earlier history. Only the explicit public-document allowlist may be rendered. Historical operating notes, source conversations, credentials, host details, and fixture content remain outside publication.",
    "Raw inbound email bodies and incoming file bytes are transient only in Rocoto. Original custody stays with the provider/user. Rocoto persists authorized source references, minimal reviewed business facts and actor/parser lineage; it cannot reconstruct a missing original from a summary. THE-SOURCE-PRIVACY-SPEC governs fetch, cache, logging, model input, deletion and legacy cleanup.",
    "E188 closes the English-kit physical UI grammar: inset one-destination rows, unvalued order projections, exact quantity/unit lines, one draft-and-apply filter apparatus, and phone keyboard/thumb navigation. No E188 UI/UX item is deferred. The separately ordered next architecture phase is Runtime/model-to-smartify-runtime/UI-embedded intelligence/Copilot execution; this does not remove or authorize any production leaf."
  ],
  "coreDocuments": [
    {
      "path": "notes/INDEX.md",
      "title": "Documentation index"
    },
    {
      "path": "notes/THE-ARCHITECTURE.md",
      "title": "Architecture"
    },
    {
      "path": "notes/THE-SYSTEM-SPEC.md",
      "title": "System specification"
    },
    {
      "path": "notes/THE-OBJECT-MAP.md",
      "title": "Object map"
    },
    {
      "path": "notes/THE-INTERACTION-SPEC.md",
      "title": "Interaction specification"
    },
    {
      "path": "notes/THE-JOURNEYS-SPEC.md",
      "title": "Cross-system journey acceptance"
    },
    {
      "path": "notes/THE-PRODUCT-SHEET-SPEC.md",
      "title": "Product sheet"
    },
    {
      "path": "notes/THE-STOCK-LOTS-SPEC.md",
      "title": "Stock and lots specification"
    },
    {
      "path": "notes/THE-CATALOGUE-CONTRACT-SPEC.md",
      "title": "Catalogue contract"
    },
    {
      "path": "notes/THE-INTELLIGENCE-SPEC.md",
      "title": "Intelligence contract"
    },
    {
      "path": "notes/WIRING-BOOT.md",
      "title": "Build entry point"
    },
    {
      "path": "notes/THE-WIRING-PLAN.md",
      "title": "Build order"
    },
    {
      "path": "notes/THE-WIRING-INDEX.md",
      "title": "Build index"
    },
    {
      "path": "notes/THE-WIRING-TASKLIST.md",
      "title": "Task list"
    },
    {
      "path": "notes/THE-UNITS-SPEC.md",
      "title": "Units and equivalences"
    },
    {
      "path": "notes/THE-SOURCE-PRIVACY-SPEC.md",
      "title": "Source privacy and provider custody"
    },
    {
      "path": "notes/RELEASE-181.md",
      "title": "English kit release and evidence"
    },
    {
      "path": "notes/RELEASE-183.md",
      "title": "E182 connected kit workflow narrative"
    }
  ],
  "docRefs": {
    "FND-01": {
      "title": "Tenant identity, authentication, and authorization",
      "document": "notes/THE-SYSTEM-SPEC.md",
      "anchor": "fnd-01"
    },
    "FND-02": {
      "title": "Canonical records, identity, history, and lifecycle",
      "document": "notes/THE-SYSTEM-SPEC.md",
      "anchor": "fnd-02"
    },
    "FND-03": {
      "title": "Commands, events, projections, and audit",
      "document": "notes/THE-SYSTEM-SPEC.md",
      "anchor": "fnd-03"
    },
    "OBJ-01": {
      "title": "Shared object-sheet contract",
      "document": "notes/THE-SYSTEM-SPEC.md",
      "anchor": "obj-01"
    },
    "PRD-01": {
      "title": "Product Sheet",
      "document": "notes/THE-SYSTEM-SPEC.md",
      "anchor": "prd-01"
    },
    "CUS-01": {
      "title": "Customer Sheet",
      "document": "notes/THE-SYSTEM-SPEC.md",
      "anchor": "cus-01"
    },
    "ALB-01": {
      "title": "Albarán Sheet",
      "document": "notes/THE-SYSTEM-SPEC.md",
      "anchor": "alb-01"
    },
    "CAT-01": {
      "title": "Catalogue admission, Internal category, Related items and artwork",
      "document": "notes/THE-SYSTEM-SPEC.md",
      "anchor": "cat-01"
    },
    "SRC-01": {
      "title": "Imports, supplier sources, and related email",
      "document": "notes/THE-SYSTEM-SPEC.md",
      "anchor": "src-01"
    },
    "INV-01": {
      "title": "Stock, lots, availability, and stock update",
      "document": "notes/THE-SYSTEM-SPEC.md",
      "anchor": "inv-01"
    },
    "COM-01": {
      "title": "Tariffs, units, taxes, money, and price history",
      "document": "notes/THE-SYSTEM-SPEC.md",
      "anchor": "com-01"
    },
    "DOC-01": {
      "title": "Delivery, print, documents, and output",
      "document": "notes/THE-SYSTEM-SPEC.md",
      "anchor": "doc-01"
    },
    "UTL-01": {
      "title": "Stock update utility",
      "document": "notes/THE-SYSTEM-SPEC.md",
      "anchor": "stock-update-utility-utl-01"
    },
    "UTL-02": {
      "title": "New product utility",
      "document": "notes/THE-SYSTEM-SPEC.md",
      "anchor": "utl-02"
    },
    "UTL-03": {
      "title": "Catalogue import utility",
      "document": "notes/THE-SYSTEM-SPEC.md",
      "anchor": "upload-utility-utl-03"
    },
    "UTL-04": {
      "title": "Export utility",
      "document": "notes/THE-SYSTEM-SPEC.md",
      "anchor": "export-utility-utl-04-and-output-jobs"
    },
    "INT-01": {
      "title": "Intelligence boundary",
      "document": "notes/THE-SYSTEM-SPEC.md",
      "anchor": "int-01-and-int-02-intelligence-boundary"
    },
    "INT-02": {
      "title": "Artwork and image generation boundary",
      "document": "notes/THE-SYSTEM-SPEC.md",
      "anchor": "int-01-and-int-02-intelligence-boundary"
    },
    "INTG-01": {
      "title": "Integrations and synchronization",
      "document": "notes/THE-SYSTEM-SPEC.md",
      "anchor": "intg-01"
    },
    "ADM-01": {
      "title": "Administration, billing, data, and settings",
      "document": "notes/THE-SYSTEM-SPEC.md",
      "anchor": "adm-01"
    },
    "OPS-01": {
      "title": "Realtime, presence, concurrency, offline, and operations",
      "document": "notes/THE-SYSTEM-SPEC.md",
      "anchor": "ops-01"
    },
    "QLT-01": {
      "title": "Security, privacy, and audit",
      "document": "notes/THE-SYSTEM-SPEC.md",
      "anchor": "qlt-01"
    },
    "QLT-02": {
      "title": "Accessibility, performance, reliability, and recovery UX",
      "document": "notes/THE-SYSTEM-SPEC.md",
      "anchor": "qlt-02"
    },
    "ACT-01": {
      "title": "Onboarding, migration, activation, and support",
      "document": "notes/THE-SYSTEM-SPEC.md",
      "anchor": "act-01"
    },
    "REL-01": {